{
  "id": "scientific.rmsd.matrix",
  "family": "scientific",
  "description": "Pairwise RMSD matrix over a collection of vector inputs.",
  "upstream_reference": "charnley.rmsd",
  "upstream_sha": "1ad8ecee48d95ab43b49bd9f2fe4f8f07d9106bd",
  "work_unit": "one scalar coordinate comparison",
  "input_sizes": ["small", "medium"],
  "reference_variants": ["python-oracle"],
  "s3_variants": [],
  "correctness_contract": {
    "formula": "sqrt(sum((A[i]-B[i])**2)/N) for every pair",
    "empty_input": "reject",
    "length_mismatch": "reject",
    "first_missing_capability": "multidimensional-data",
    "evidence": "The pinned candidate has scalar f64_vector operations but no matrix workload driver.",
    "minimum_required_capability": "deterministic nested collection iteration"
  },
  "build_recipe": {"reference": "reference.py"},
  "run_recipe": {"mode": "not_supported_yet", "network": false},
  "measurement_protocol": {"timing_scope": "KERNEL", "warmups": 0, "repetitions": 1, "synthetic_timing": false},
  "capability_requirements": ["multidimensional-data"],
  "status": "NOT_SUPPORTED_YET"
}
